CVE,Vulnerability_Type,CVSS_Base_Score,CVSS_Base_Severity,CVSS_Vector_Base,EPSS_Probability,EPSS_Percentile,Layer_Applied,Notes
CVE-2025-29824,"Windows CLFS Driver EoP (kernel)",7.8,HIGH,CVSS:3.1/AV:L/AC:L/PR:L/UI:N/S:U/C:H/I:H/A:H,TODO,TODO,4,"Exploited by Storm-2460 and Balloonfly via LotL with certutil.exe. Controls: C2 MPR:H | C3 MAC:H (AppLocker+EDR) | C4 CIA:L. Environmental Score reduction: 50.0%."
CVE-2023-34362,"MOVEit Transfer SQLi RCE",9.8,CRITICAL,CVSS:3.1/AV:N/AC:L/PR:N/UI:N/S:U/C:H/I:H/A:H,TODO,94,4,"Exploited by Cl0p ransomware in 2700+ organizations. Controls: C1 MAV:A (ACL) | C3 MAC:H (WAF+FIM) | C4 CIA:L. Environmental Score reduction: 34.7%."
CVE-2024-3094,"XZ Utils backdoor (supply chain)",10.0,CRITICAL,TODO,TODO,TODO,4,"Backdoor in liblzma by Jia Tan, discovered 2024-03-29. Base Score includes AC:H per article. Controls: C1 MAV:A (VPN) | C3 SBOM+Sigstore | C4 CIA:L. Environmental Score reduction: 42.0%."
CVE-2024-6387,"regreSSHion OpenSSH RCE (race condition)",8.1,HIGH,CVSS:3.1/AV:N/AC:H/PR:N/UI:N/S:U/C:H/I:H/A:H,TODO,70,4,"AC:H recognizes race condition difficulty. Controls: C1 MAV:A (ACL) | C3 sshd_config+fail2ban | C4 CIA:L. Environmental Score reduction: 38.3%. EPSS reached 70th percentile first month, then dropped to zero by Sep 2024."
CVE-2024-21762,"FortiOS SSL VPN OOB Write",9.8,CRITICAL,TODO,TODO,"Near zero first 6 months",4,"Vendor declared no workaround except disabling SSL VPN. Controls: C1 MAV:A (geo-blocking+ACL) | C3 MAC:H (IPS) | C4 MC:L. Environmental Score reduction: 27.6%."
CVE-2021-34527,"PrintNightmare EoP/RCE (service)",8.8,HIGH,TODO,TODO,TODO,4,"Historical reference case. Three consecutive Microsoft patches bypassed. Controls: C1 MAV:A (VLAN) | C2 MPR:H (GPO) | C4 CIA:L. Environmental Score reduction: 51.1%."
